{
  "id": "cdx-20250924_223240-mcp-e2e-logs",
  "pid": 343,
  "state": "running",
  "exit_code": null,
  "classification": null,
  "tokens_used": null,
  "cwd": "/home/stark/codex",
  "created_at": "2025-09-24T14:32:40Z",
  "updated_at": "2025-09-24T14:32:40Z",
  "tag": "mcp-e2e-logs",
  "log_file": "/home/stark/codex/codex-command/runs/cdx-20250924_223240-mcp-e2e-logs/job.log",
  "meta_glob": "/home/stark/codex/codex-command/runs/cdx-20250924_223240-mcp-e2e-logs/*.meta.json",
  "last_message_glob": "/home/stark/codex/codex-command/runs/cdx-20250924_223240-mcp-e2e-logs/*.last.txt",
  "args": ["--task","E2E logs filters","--dry-run"],
  "title": null
}
