{
  "id": "cdx-20250924_195212-mcp-demo",
  "pid": 14109,
  "state": "running",
  "exit_code": null,
  "classification": null,
  "tokens_used": null,
  "cwd": "/home/stark/codex",
  "created_at": "2025-09-24T11:52:12Z",
  "updated_at": "2025-09-24T11:52:12Z",
  "tag": "mcp-demo",
  "log_file": "/home/stark/codex/codex-command/runs/cdx-20250924_195212-mcp-demo/job.log",
  "meta_glob": "/home/stark/codex/codex-command/runs/cdx-20250924_195212-mcp-demo/*.meta.json",
  "last_message_glob": "/home/stark/codex/codex-command/runs/cdx-20250924_195212-mcp-demo/*.last.txt",
  "args": [],
  "title": null
}
