{
  "id": "cdx-20250924_201916-e2e-c2",
  "pid": 25581,
  "state": "running",
  "exit_code": null,
  "classification": null,
  "tokens_used": null,
  "cwd": "/home/stark/codex",
  "created_at": "2025-09-24T12:19:17Z",
  "updated_at": "2025-09-24T12:19:17Z",
  "tag": "e2e-c2",
  "log_file": "/home/stark/codex/codex-command/runs/cdx-20250924_201916-e2e-c2/job.log",
  "meta_glob": "/home/stark/codex/codex-command/runs/cdx-20250924_201916-e2e-c2/*.meta.json",
  "last_message_glob": "/home/stark/codex/codex-command/runs/cdx-20250924_201916-e2e-c2/*.last.txt",
  "args": ["--task","E2E c2","--dry-run"],
  "title": null
}
