{
  "id": "cdx-20250924_201914-e2e-stop",
  "pid": 25100,
  "state": "running",
  "exit_code": null,
  "classification": null,
  "tokens_used": null,
  "cwd": "/home/stark/codex",
  "created_at": "2025-09-24T12:19:14Z",
  "updated_at": "2025-09-24T12:19:14Z",
  "tag": "e2e-stop",
  "log_file": "/home/stark/codex/codex-command/runs/cdx-20250924_201914-e2e-stop/job.log",
  "meta_glob": "/home/stark/codex/codex-command/runs/cdx-20250924_201914-e2e-stop/*.meta.json",
  "last_message_glob": "/home/stark/codex/codex-command/runs/cdx-20250924_201914-e2e-stop/*.last.txt",
  "args": ["--task","E2E stop","--dry-run"],
  "title": null
}
