{
  "id": "cdx-20250924_222754-s1-tk-001",
  "pid": 25904,
  "state": "failed",
  "exit_code": -1,
  "classification": "error",
  "tokens_used": null,
  "cwd": "/home/stark/react-arch-wizard-mcp",
  "created_at": "2025-09-24T14:27:54Z",
  "updated_at": "2025-09-24T14:28:10Z",
  "tag": "s1-tk-001",
  "log_file": "/home/stark/codex/codex-command/runs/cdx-20250924_222754-s1-tk-001/job.log",
  "meta_glob": "/home/stark/codex/codex-command/runs/cdx-20250924_222754-s1-tk-001/*.meta.json",
  "last_message_glob": "/home/stark/codex/codex-command/runs/cdx-20250924_222754-s1-tk-001/*.last.txt",
  "title": null
}
