{
  "id": "cdx-20250924_230053-mcp-smoke",
  "pid": 21612,
  "state": "running",
  "exit_code": null,
  "classification": null,
  "tokens_used": null,
  "cwd": "/home/stark/codex-father",
  "created_at": "2025-09-24T15:00:53Z",
  "updated_at": "2025-09-24T15:00:53Z",
  "tag": "mcp-smoke",
  "log_file": "/home/stark/codex-father/runs/cdx-20250924_230053-mcp-smoke/job.log",
  "meta_glob": "/home/stark/codex-father/runs/cdx-20250924_230053-mcp-smoke/*.meta.json",
  "last_message_glob": "/home/stark/codex-father/runs/cdx-20250924_230053-mcp-smoke/*.last.txt",
  "args": ["--task","MCP smoke","--dry-run"],
  "title": null
}
