{
  "id": "cdx-20250924_200830-logs-check",
  "pid": 22000,
  "state": "running",
  "exit_code": null,
  "classification": null,
  "tokens_used": null,
  "cwd": "/home/stark/codex",
  "created_at": "2025-09-24T12:08:30Z",
  "updated_at": "2025-09-24T12:08:30Z",
  "tag": "logs-check",
  "log_file": "/home/stark/codex/codex-command/runs/cdx-20250924_200830-logs-check/job.log",
  "meta_glob": "/home/stark/codex/codex-command/runs/cdx-20250924_200830-logs-check/*.meta.json",
  "last_message_glob": "/home/stark/codex/codex-command/runs/cdx-20250924_200830-logs-check/*.last.txt",
  "args": ["--task","Bytes logs demo","--dry-run"],
  "title": null
}
